{
  "id": "task:quote_acme",
  "organization_id": "org:northstar",
  "actor_id": "employee:sales-owner",
  "purpose": "enterprise_quote",
  "deliverable_kind": "QUOTE",
  "requested_at": "2026-08-15T00:00:00Z",
  "template_ref": "template:enterprise_quote@v1",
  "input_values": {
    "owner": "sales-owner"
  },
  "customer_id": "customer:acme",
  "idempotency_key": "workspace:form:quote-acme@v1"
}
